Name,System,Book,Prerequisite,Alignment,Starting Characteristics Bonuses,Starting Skills,Starting Specialist Skills,Starting Skill Choices,Starting Talents,Starting Talent Choices,Starting Armor,Starting Weapons,Starting Gear,Starting Equipment Choices,Starting Traits,Wounds,Starting Powers Budget,Starting Powers Disciplines,Starting Psyker Class
Champion,BC,Core,Chaos Space Marine,Unaligned,,Command,,"Charm or Deceive, Intimidate or Scrutiny,  Scholastic Lore (any one)",Iron Discipline,"Air of Authority or Disturbing Voice, Lesser Minion of Chaos or Sure Strike",,Legionnaire Power Sword,,,Inspiring Presence,15,,,
Chosen,BC,Core,Chaos Space Marine,Unaligned,,"Intimidate, Stealth",,Dodge (+10) or Parry (+10),Lightning Reflexes,"Quick Draw or Rapid Reload, Disarm or Double Team, Sure Strike or Deadeye Shot",,"Legion Bolt Pistol, Legion Chainsword,",Clip (Legion Bolt Pistol) x2,,Cold Killer,16,,,
Forsaken,BC,Core,Chaos Space Marine,Unaligned,,"Acrobatics, Survival",,"Commerce or Security, Common Lore (any one) or Survival +10",Jaded,"Hatred (Pick One), Light Sleeper or Blind Fighting, Cold Hearted or Sound Constitution",,"Legion Chainsword, Legion Shotgun","Legion Frag Grenades x4, Clip (Legion Shotgun) x2",,Resourceful,15,,,
Sorcerer,BC,Core,Chaos Space Marine,Unaligned,corruption:  1,Psyniscience,Scholastic Lore (Occult),"Deception or Scrutiny, Forbidden Lore (Daemons) or Forbidden Lore (Psykers)",Psy Rating (x2),Meditation or Mimic,,Legion Bolt Pistol,,Force Weapon,"Psyker, Sorcerer",15,500,"Unaligned, Divination, Telepathy, Telekinesis",bound
Apostate,BC,Core,Human,Unaligned,fellowship: 5,"Awareness, Charm, Command, Deceive, Inquiry",,"Scholastic Lore (any three), Forbidden Lore (any three), Dodge or Parry, Intimidate or Commerce, Charm +10 or Deceive +10, Command +10 or Inquiry +10, Security or Stealth or Logic","Air of Authority, Total Recall, Unshakeable Will, Weapon Training (Las, Primary)","Hatred (any one), Peer (any one), Disturbing Voice or Radiant Presence, Polyglot or Mimic, Inspire Wrath or Iron Discipline or Lesser Minion of Chaos",,Good-Craftsmanship Laspistol,"Chaos symbol pendant, unholy tomes, 2 laspistol clips.","Best-Craftsmanship Sword or Common Craftsmanship Power Blade, Flak Armour or Mesh Armour,",Serpent's Tongue,9,,,
Heretek,BC,Core,Human,Unaligned,intelligence: 5,"Logic, Tech Use,","Common Lore (Adeptus Mechanicus), Common Lore (Tech)"," Dodge or Parry, Security or Tech Use +10, Forbidden Lore (Archeotech) or Forbidden Lore (Xenos) or Forbidden Lore (Warp), Scholastic Lore (Astromancy) or Scholastic Lore (Chymistry)","Die Hard, Technical Knock, Weapon Training (Las, Primary, Shock), Enemy (Adeptus Mechanicus)","Weapon Training (Bolt) or Weapon Training (Plasma) or Weapon Training (Power), Mechadendrite Training (Weapon) or Mechadendrite Training (Utility), Meditation or Total Recall, Armour-Monger or Weapon-Tech, Lesser Minion of Chaos (Must be servitor or servo-skull) or Cold Hearted,",Light Carapace Armour,Best-Craftsmanship Lascarbine,"Unholy Unguents, combi-tool, dataslate","Common-Craftsmanship Power Axe or Good Craftsmanship Great Weapon (Greataxe), any two Good Craftsmanship cybernetics, Optical Mechadendrite or Utility Mechadendrite or Ballistic Mechadendrite with Laspistol, Lumenin Capacitors or Maglev Coils or Ferric Lure Implants","Mechanicus Implants, Traitor to Mars",12,,,
Renegade,BC,Core,Human,Unaligned,"weapon_skill: 3, ballistic_skill: 3","Athletics, Awareness, Dodge, Parry","Scholastic Lore (Tactica Imperialis), Common Lore (War)","Operate (any one), Command or Intimidate, Dodge +10 or Parry +10, Survival or Stealth, Tech Use or Medicae","Jaded, Quick Draw, Rapid Reload, Weapon Training (Chain, Las, Primary, SP)","Heavy Weapon Training (Any One), Weapon Training (Bolt) or Weapon Training (Shock), Catfall or Combat Sense, Sure Strike or Deadeye Shot or Marksman, Double Team or Disarm or Takedown, Ambidextrous or Hip Shooting",Carapace Armour,,"Medikit, Dataslate with annotated version of Tactica Imperialis","Best-Craftsmanship Lasgun or Good Craftsmanship Boltgun or Common Craftsmanship Plasma Gun or Common Craftsmanship Heavy Flamer, Best-Craftsmanship Laspistol or Common Craftsmanship Bolt Pistol, Best Craftsmanship Chainsword or Common-Craftsmanship Power Mace",Adroit,10,,,
Psyker,BC,Core,Human,Unaligned,willpower:5,"Awareness, Psyniscience ",Forbidden Lore (Psykers),"Deceive or Intimidate, Dodge or Parry","Psy Rating 3, Jaded, Weapon Training (Primary)","Weapon Training (Las) or Weapon Training (SP) or Weapon Training (Shock), Warp Sense or Child of the Warp",Flak Cloak,,"Psy-focus, dataslate filled with arcane lore.","Common Craftsmanship Laspistol or Common Craftsmanship Stub Revolver, Good Craftsmanship Sword or Common Craftsmanship Neural Whip","Chaos Psyker, Psyker",8,500,"Unaligned, Divination, Telepathy, or Telekinesis",Unbound